,topic
0,The quantum entanglement of ideas
1,A debate between different types of cheese
2,The birth of a new color
3,Memories of a forgotten dimension
4,The evolution of silence
5,A love story between opposite mathematical concepts
6,The taste of a word never spoken
7,Echoes of laughter in an empty universe
8,The autobiography of tomorrow
9,A dialogue between light and darkness
10,The geometry of a dream
11,The weight of a soul in kilobytes
12,A symphony composed by random numbers
13,The cartography of emotions
14,Reflections on the curvature of time
15,The archaeology of imagination
16,A recipe for cooking up a new element
17,The taxonomy of invisible creatures
18,Blueprints for building a better metaphor
19,The thermodynamics of hope
20,A user manual for operating free will
21,The migration patterns of abstract thoughts
22,Footnotes to an unwritten holy book
23,The crystallization of a moment
24,A field guide to imaginary plants
25,The economics of trading in memories
26,Instructions for folding the fabric of reality
27,The geology of a mindscape
28,A treaty between order and chaos
29,The aerodynamics of a whisper
30,Blueprints for a time machine made of words
31,The chemistry of an unspoken promise
32,A bestiary of emotional states
33,The physics of a broken heart
34,An encyclopedia of things that never were
35,The architecture of a silence
36,A map of the territories between breaths
37,The biology of a dying star
38,Sketches of theoretical emotions
39,The archaeology of future ruins
40,A dictionary of untranslatable experiences
41,The climatology of mood swings
42,Blueprints for a bridge between realities
43,The ecology of abandoned ideas
44,A census of imaginary friends
45,The oceanography of consciousness
46,An algorithm for generating serendipity
47,The linguistics of body language
48,A portfolio of investments in dreams
49,The astronomy of introspection
50,A guidebook to undiscovered countries of the mind
51,The botany of artificial intelligence
52,An inventory of cosmic loose ends
53,The mathematics of human connection
54,A chronicle of events that never happened
55,The physics of deja vu
56,An anthology of unwritten novels
57,The chemistry of first impressions
58,A catalog of hypothetical inventions
59,The sociology of inanimate objects
60,An atlas of unexplored emotions
61,The neurology of creativity
62,A manifesto for a revolution of kindness
63,The linguistics of silence
64,An itinerary for a journey through the self
65,The ecology of digital ecosystems
66,A taxonomy of different types of nothing
67,The archaeology of the internet
68,A blueprint for constructing new dimensions
69,The physics of a moral dilemma
70,An encyclopedia of theoretical philosophies
71,The botany of abstract concepts
72,A field guide to psychological landscapes
73,The chemistry of collective consciousness
74,An owner's manual for the human condition
75,The mathematics of free will
76,A dictionary of colors invisible to the human eye
77,The geology of cultural shifts
78,A catalog of undiscovered elements
79,The thermodynamics of social change
80,An anthology of untold histories
81,The biology of artificial emotions
82,A map of the edges of knowledge
83,The astronomy of inner space
84,A guidebook to navigating paradoxes
85,The physics of empathy
86,An inventory of potential futures
87,The linguistics of unspoken thoughts
88,A portfolio of emotional currencies
89,The oceanography of digital information
90,A census of extinct ideas
91,The climatology of global consciousness
92,Blueprints for a machine that manufactures luck
93,The ecology of memes
94,A user manual for alternative realities
95,The mathematics of beauty
96,An atlas of fictional geographies
97,The quantum mechanics of decision-making
98,A chronicle of parallel universes
99,The chemistry of interpersonal magnetism
